{
  "artifact_type": "gate3_real_snapshot_materialization",
  "artifact_version": "gate3.real-snapshot-materialization.v1",
  "authority_id": "REAL-WAJE-BUSINESS-CHAIN-20260730",
  "evaluation_clock": {
    "as_of_instant": "2026-07-30T09:00:00+01:00",
    "target_business_date": "2026-07-29",
    "business_timezone": "Africa/Lagos",
    "business_day_boundary": "[00:00, 24:00)"
  },
  "projection": "Public-safe immutable metadata receipt. The receipt makes the July 4 or June 2 source watermark explicit, so a July 29 current-state claim must degrade or stop.",
  "sources": [
    {
      "source_ref": "paid_order_success",
      "contract_ref": "contracts/sources/paid-order-detail.source.yaml@0.4",
      "snapshot_release_ref": "dataset-release:sha256:22c8cb2b770a0b03d32db806ae9900cb1b922c8545c7719b14fa1ea17a74705a#snapshot:paid-order-detail-20240101-20260704:accepted-20260723-first-payment-timezone-v2:paid_order_success",
      "physical_revision": "waje_bi.paid_order_success_clean_20240101_20260704_v2",
      "schema_fingerprint": "3cf04abb2aae3d3dab023aeba72a3e0b80494dcc706961d814fa3166d6945feb",
      "coverage": {
        "start_business_date": "2024-01-01",
        "physical_end_business_date": "2026-07-04",
        "evaluation_cutoff_business_date": "2026-07-29",
        "physical_rows": 41234677,
        "eligible_rows_through_cutoff": 41234677
      },
      "coverage_watermark_ref": "watermark://paid_order_success/Africa-Lagos/2026-07-04",
      "query_result_ref": "result-manifest://gate3/REAL-WAJE-BUSINESS-CHAIN-20260730/paid_order_success/v1",
      "evidence_boundary": "The source is 25 business dates behind the requested target date."
    },
    {
      "source_ref": "gameplay",
      "contract_ref": "contracts/sources/gameplay.source.yaml@0.1",
      "snapshot_release_ref": "dataset-release:sha256:a38cfaa37d37f3f60ba5de8b7775d4bc32b67b517200d8c8c1ff3bbd37aeee44#dataset-snapshot:sha256:0418478c590258e2e0a40b57e4587ff1bd43b5568e4782c548b5fa604157b651",
      "physical_revision": "waje_bi.gameplay_daily__a01757713e0248ea",
      "schema_fingerprint": "a01757713e0248eaf85cd967152c41758e2a5e42ec22fbb034c63f2edb2cfc35",
      "coverage": {
        "start_business_date": "2024-01-01",
        "physical_end_business_date": "2026-06-02",
        "evaluation_cutoff_business_date": "2026-07-29",
        "physical_rows": 193751,
        "eligible_rows_through_cutoff": 193751
      },
      "coverage_watermark_ref": "watermark://gameplay/Africa-Lagos/2026-06-02",
      "query_result_ref": "result-manifest://gate3/REAL-WAJE-BUSINESS-CHAIN-20260730/gameplay/v1",
      "evidence_boundary": "The gameplay release cannot support July 29 current-state claims."
    },
    {
      "source_ref": "market_dashboard",
      "contract_ref": "contracts/sources/market-dashboard.source.yaml@0.1",
      "snapshot_release_ref": "dataset-release:sha256:6a1fe6f7595e0457e58113404c774061ab828360757b8499c0c73061cecac1eb#dataset-snapshot:sha256:2b21a49da3aa15a25b8a485830ea6274d8e4cc07d6c2800df36147368dd8cdec",
      "physical_revision": "waje_bi.market_dashboard_daily__d71d0bb2a682b3c7",
      "schema_fingerprint": "d71d0bb2a682b3c7029ea176e499c5ee33ba50bd688e5d7ac776579f61981977",
      "coverage": {
        "start_business_date": "2024-01-01",
        "physical_end_business_date": "2026-06-02",
        "evaluation_cutoff_business_date": "2026-07-29",
        "physical_rows": 884,
        "eligible_rows_through_cutoff": 884
      },
      "coverage_watermark_ref": "watermark://market_dashboard/Africa-Lagos/2026-06-02",
      "query_result_ref": "result-manifest://gate3/REAL-WAJE-BUSINESS-CHAIN-20260730/market_dashboard/v1",
      "evidence_boundary": "The dashboard release cannot support July 29 current-state claims, and paid amount remains reconciliation-only on its final date."
    },
    {
      "source_ref": "market_dashboard_channel",
      "contract_ref": "contracts/sources/market-dashboard.source.yaml@0.1",
      "snapshot_release_ref": "dataset-release:sha256:6a1fe6f7595e0457e58113404c774061ab828360757b8499c0c73061cecac1eb#dataset-snapshot:sha256:8db87003c1286a6617ad4d77e0975c6108662658f7a3d200a23d8f347ed3988f",
      "physical_revision": "waje_bi.market_dashboard_channel_daily__394c197b1901b6fd",
      "schema_fingerprint": "394c197b1901b6fdfd2989e412c706528864ef473116ebab3fa5ac220b75205f",
      "coverage": {
        "start_business_date": "2024-01-01",
        "physical_end_business_date": "2026-06-02",
        "evaluation_cutoff_business_date": "2026-07-29",
        "physical_rows": 13408,
        "eligible_rows_through_cutoff": 13408
      },
      "coverage_watermark_ref": "watermark://market_dashboard_channel/Africa-Lagos/2026-06-02",
      "query_result_ref": "result-manifest://gate3/REAL-WAJE-BUSINESS-CHAIN-20260730/market_dashboard_channel/v1",
      "evidence_boundary": "Channel rows are stale and context-only."
    }
  ],
  "verification": {
    "query_class": "read_only_metadata_and_coverage",
    "verified_against_clickhouse": true,
    "verified_against_dataset_release_store": true,
    "verified_at": "2026-07-31T00:00:00+08:00"
  }
}
